0,亚托克斯,暗裔剑魔,符文之地,战士,暗裔,2013/6/13,"亚托克斯曾是恕瑞玛抗击虚空时的伟大战士。但是，他和他的同胞却有可能变成符文之地更大的威胁。最终，他们败给了凡人的狡诈巫术，自身的精魂被锁在了武器之内。数百年的监禁之后，亚托克斯头一个挣脱出来，腐蚀并转化那些胆敢染指的蠢人。现在，他将夺来的血肉模仿着自己曾经的形象粗暴地重塑，渴望着迟来许久的末世复仇。
"
1,阿狸,九尾妖狐,艾欧尼亚,法师,瓦斯塔亚,2011/12/14,天生就与精神领域的魔法存在连接的阿狸，是一名狐狸模样的瓦斯塔亚，在世界上寻找着自己所属的位置。进入凡人社会以后，她成为了一名充满悔意和同情心的掠食者，她喜欢操纵猎物的情绪，然后再吸食他们的生命精魄——每吞噬一个灵魂，都伴着他们生前的记忆片段与领悟洞见。
2,阿卡丽,离群之刺,艾欧尼亚,刺客,人类,2010/5/11,"无论是均衡教派还是暗影之拳的称号，都已被阿卡丽抛弃，如今的阿卡丽独来独往，随时可以成为她的人民所需要的夺命武器。虽然她牢牢铭记着她从宗师慎身上学来的一切，但她效忠保护艾欧尼亚并铲除敌人，每次一条命。或许阿卡丽的出击悄然无声，但她传达的信息将响亮无比：不听命于任何人的刺客最为可怕。
"
3,阿克尚,影哨,恕瑞玛,射手,人类,2021/7/8,面对天大的危险，阿克尚也只会轻轻挑起一边眉毛。他身手矫健，嫉恶如仇——而且显而易见，他对服饰兴趣不大。阿克尚非常善于潜行，能够避开敌人的耳目，出现在最令人出其不意的时机。他怀着强烈的正义感，带着一把可以逆转生死的传奇武器，在符文之地上主持公道，惩治邪祟。他以自己的生命践行着自己的信条：“不做混蛋。”
4,阿利斯塔,牛头酋长,符文之地,坦克,瓦斯塔亚,2009/2/21,阿利斯塔一直都是威名远扬的巨力勇士，他要为自己被屠杀的氏族向诺克萨斯帝国复仇。虽然他曾被奴役，并被迫成为斗兽场中的角斗士，但他坚不可摧的意志使他免于沦为真正的野兽。现在，挣脱了奴役枷锁的他继续以受苦之人和弱者的名义战斗。他的愤怒，还有犄角、蹄子和拳头，都是他的武器。
5,阿木木,殇之木乃伊,恕瑞玛,坦克,约德尔人,2009/6/26,在远古的恕瑞玛，有一个孤独而又忧郁的灵魂，阿木木。他在世间游荡，只为找到一个朋友。他遭受了一种远古的巫术诅咒，注定忍受永世的孤单，因为被他触碰就意味着死亡，他的喜爱便是毁灭。所有自称见过阿木木的人都说他是一具活生生的死尸，身材矮小，通体捆绑着青灰色的绷带。世人围绕阿木木编造了许多神话故事、民间传说和史诗传奇。这些故事世代传颂，以至于再也没人能分得清哪些是真相，哪些是幻想。
6,艾尼维亚,冰晶凤凰,弗雷尔卓德,法师,神,2009/7/10,艾尼维亚是一个充满仁慈的飞禽形态灵体，曾经历过无数次诞生、死亡与重生的轮回，始终眷顾着弗雷尔卓德。她是生于凛冽冰风中的半神，可以操控冰雪的元素之力，阻挡那些胆敢侵犯她家园的人。艾尼维亚指引并保护着北方贫瘠土地上的人类部落，而这些人类也将她奉为希望的象征和重大变革的预兆。她的每一次奋战都不遗余力，因为她知道，自己的记忆将会超越牺牲，长久地留存，而她也将在崭新的明天中重生。
7,安妮,黑暗之女,符文之地,法师,人类, 2009/02/21,"既拥有危险夺命的能力，又拥有小大人儿的可爱模样，安妮是一名掌握着深不可测的炎能魔法的幼女魔法师。安妮生活在诺克萨斯北边的山脚下，即使是在这种地方，她也仍然是魔法师中的异类。她与火焰的紧密关系与生俱来，最初是伴随着喜怒无常的情绪冲动出现的，不过后来她学会了如何掌握这些“小把戏”。其中她最喜欢的就是召唤她亲爱的泰迪熊提伯斯。巨熊带着地狱烈焰咆哮而出，肆意破坏。安妮已经迷失在了永恒的天真里。她在黑暗的森林中游荡，始终寻觅着能陪自己玩耍的人。
"
8,厄斐琉斯,残月之肃,巨神峰,射手,人类,2019/11/19,如月影般神出鬼没、时刻剑拔弩张的厄斐琉斯沉默地弑杀一切自身信仰的敌人。他的语言只有精确的瞄准和枪火。虽然他饮下了让他失声的毒药，但他也因此得到了妹妹拉露恩的引导，从遥远的神庙中将月石打造的各种武器送到他手里。只要头顶的明月依然皎洁，厄斐琉斯就永不孤单。
9,艾希,寒冰射手,弗雷尔卓德,射手,寒冰血脉,2009/2/21,作为阿瓦罗萨部族的战母，寒冰血脉的艾希率领着北方人数最多的部落。她克己、智慧、忠于理想，但并不适应自己作为领袖的角色，艾希与自己血脉中蕴藏的先祖魔法相通，挽起了臻冰打造的长弓。她的族人相信她就是神话中的女英雄阿瓦罗萨的转世，在人们的追随下，艾希希望夺回那些属于部族的古代领土，从而让弗雷尔卓德再次实现统一。
10,奥瑞利安·索尔,铸星龙王,符文之地,法师,神,2016/3/24,奥瑞利安•索尔创造了奇迹般的群星，为无垠的荒芜太空布下他宏伟的恩典，但却遭到巨神星灵的算计，揭示了一颗他所铸造的太阳的秘密。他的神力被抽走，并制造出不朽的天神战士，用来保护那个无足轻重的星球——符文之地。如今，为了重新掌控宇宙，奥瑞利安•索尔誓要夺回属于自己的自由。哪怕召星降怒，倾覆众生。
11,阿兹尔,沙漠皇帝,恕瑞玛,法师,飞升者,2014/9/16,阿兹尔是上古时期恕瑞玛的一位凡人皇帝，一位站在不朽神话巅峰的自豪之人。但他的狂妄引来了旁人的背叛，在最伟大胜利降临的那一刻将他杀害。而现在，数千年后，他重获新生并成为了力量无边的飞升者。阿兹尔的城市已经从黄沙之下崛起，他要让恕瑞玛恢复曾经的荣光。
12,巴德,星界游神,符文之地,辅助,神,2015/3/12,巴德是星界彼端的旅者，是奇缘巧遇的使者。他努力地维护着宇宙中的美妙协调，游走于创造物之间，以及遥远彼方冰冷、无情的存在。符文之地有许多人传唱关于他的歌谣，内容里流露出对他超凡本质的猜想，而所有这些歌谣都会提及同一件事：这位星界游荡者总是会被强大的魔法圣物所吸引。一群木灵欢唱乐团始终围绕在巴德身边充当小帮手，他的行为绝不会被误会带有任何恶意，因为他永远都是在为更大的良善尽职尽责……只不过他的方式不为常人理解。
13,布里茨,蒸汽机器人,祖安,坦克,非人,2009/9/2,锃亮的金属、滚烫的蒸汽和噼啪作响的闪电组成了铁巨人布里茨，他不知疲倦地走在祖安的街道上，努力改善这座地下都市并帮助困境中的人。他最初被创造出来是为了进入祖安城内最危险恶劣的环境中处理有害废料，但他的进化已经远超源程序的设计范围，因为他有一位天才发明者，还有海克斯科技的神秘力量。
14,布兰德,复仇焰魂,符文之地,法师,人类,2011/4/12,"<i>基根·诺和曾经是一名普通弗雷尔卓德部族居民，现在则变成了另一种生物，布兰德。他的身世警醒着后人，被更强大的力量所诱惑会带来什么后果。基根为了追寻传说中的世界符文，背叛了自己的同伴并将符文据为己有，就在那一瞬间，这个人彻底消失了。他的灵魂被彻底燃尽，他的身躯成为了活体烈焰的容器，如今，布兰德游荡在瓦洛兰，寻觅着其他的符文。他曾遭受的苦难，凡人活上十几辈子也绝无可能经历，而他发誓此仇必报。</i>
"
15,布隆,弗雷尔卓德之心,弗雷尔卓德,辅助,人类,2014/5/12,拥有大块肌肉和更大颗心脏的布隆，是一位受人爱戴的弗雷尔卓德冰裔英雄。凝霜港以北的任何一家蜜酒坊里都有人会致敬他传奇般的强壮，讲述他的事迹，例如在一夜之间扫平一整片橡树森林，还有用拳头把一整座山打成碎石子。一扇附有魔法的秘库大门被他拿在手中当做盾牌，布隆是游荡在在北方的冻土上快乐的保护者，帮助所有危难之中的人，一步步迈向他的梦想：一个和平安定的弗雷尔卓德。
16,凯特琳,皮城女警,皮尔特沃夫,射手,人类,2011/1/4,凯特琳被誉为皮尔特沃夫最顶尖的和平卫士，同时也是让这座城市真正摆脱地下隐秘犯罪的最有希望的人选。她经常和蔚联手执行任务，以冷静和沉着弥补自己搭档的鲁莽天性。虽然她的海克斯科技步枪独一无二，但凯特琳最强大的武器其实是她过人的智谋，总是能设下天罗地网，迎接任何傻到敢在进步之城作案的不法之徒。
17,卡蜜尔,青钢影,皮尔特沃夫,战士,人类,2016/11/28,卡蜜尔是菲罗斯家族的首席密探，也是一台精密的人形兵器。她游走于法律已然失效的边缘地带，小心地维护着皮尔特沃夫这台机器和其下的祖安，保证一切都能顺畅地运转。头脑灵活、行动精准，在她眼中任何浮皮潦草的技术都是必须被禁绝的丑陋行径。卡蜜尔的心智和她随身的刀刃一样锐利，她追求极致，对自己进行了大幅度的海克斯人体增强手术。这也让很多人不禁怀疑，如今的她究竟是一台机器还是一个女人。
18,卡西奥佩娅,魔蛇之拥,诺克萨斯,法师,人类,2010/12/14,卡西奥佩娅是个致命的生物，决心要操纵其他人屈服于自己的意志之下。身为诺克萨斯贵族杜•克卡奥家族的最年轻、最漂亮的女儿，她冒险深入恕瑞玛古代墓穴找寻远古的力量。在墓穴中，她被恐怖的墓穴守卫咬中，在毒液的作用下变成了毒蛇外形的掠食者。狡猾而敏捷的卡西奥佩娅如今在夜幕的掩护下蜿蜒滑行，用阴森的凝视让敌人石化。
19,科加斯,虚空恐惧,虚空之地,坦克,虚空生物,2009/6/26,自从科加斯出现在符文之地烈日照射之下的那一刻起，它就被永不餍足的饥饿所驱使。虚空吞噬一切生命的欲望完美地体现在科加斯的身上，它复杂的生物构造能够迅速将物质转化为身体的成长，不仅会增加肌肉的质量和密度，还能让外壳变得有如钻石般坚硬。当单纯的体型增长已经不能满足它时，这只虚空生物就会将多余的物质形成锋利的骨刺吐出体外，刺穿猎物，为稍后的盛宴进行准备。
20,库奇,英勇投弹手,班德尔城,射手,约德尔人,2009/9/19,约德尔飞行员库奇最爱两件事物：一是飞行，二是自己英俊的小胡子，排名不分先后。离开班德尔城以后，他在皮尔特沃夫安家，从此爱上了这里奇异壮观的各式机器。他决定投身于飞行装置的开发事业，带领一群老练飞行员组成了一只空中防御力量，得名“尖啸之蛇”。临危不乱的库奇在他第二故乡的空域戒备巡逻，而他还从没见过什么问题是一轮导弹齐射不能解决的。
21,德莱厄斯,诺克萨斯之手,诺克萨斯,战士,人类,2012/5/23,提到诺克萨斯力量的象征，帝国上下没有人能比德莱厄斯这名久经沙场的战士更加适合。他从无名小卒逐渐成长为诺克萨斯之手，劈开了无数敌人的身躯 —— 其中也不乏诺克萨斯自己人。他从不怀疑自己执行的公义，也从不会在举起战斧后迟疑。作为崔法利军团指挥官，德莱厄斯的任何对手都不用指望他手下留情。
22,黛安娜,皎月女神,巨神峰,战士,人类,2012/8/7,手持新月形状的月刃、身披冬夜白雪般的闪亮铠甲，黛安娜是皎白银月之力的现世化身。她的体内注入了巨神峰彼端的星灵精粹，如今的黛安娜已经不再是单纯的人类，同时也在艰难地理解着自己所拥有的力量、自己在这世上的意义。
23,德莱文,荣耀行刑官,诺克萨斯,射手,人类,2012/6/6,在诺克萨斯，有一种战士被称为“清算人”。他们在竞技场里互相厮杀，以鲜血作为赌注进行力量的考验，不过没有任何人能像德莱文那样受人追捧。曾经参过军的他，发现竞技场的观众们尤为喜爱他的耀武扬威和刻意表演，更不要提他每一记飞斧溅出的大片鲜血。这种狂傲的完美带来的赞叹令他上瘾，因此德莱文发誓要不惜代价打败任何对手，以此确保自己的名字在帝国之中永世传唱。
24,蒙多医生,祖安狂人,祖安,战士,人类,2009/9/2,精神与认知彻底崩坏、杀人的欲望永不满足、浑身皮肤紫得发黑，这就是蒙多医生，这就是祖安人在漆黑的夜里不敢出门的原因。如今的他自封为一名医生，但在以前，他是祖安最臭名昭著的疯人院里的病人。在“治愈”疯人院里的全体工作人员后，蒙多医生在过去收治他的空病房里搭起了手术台，有模有样地还原起他当年亲历的各种非人实验。蒙多医生的药柜里装满了瓶瓶罐罐，脑子里却丝毫没有半点医学知识。随着他把药剂一针针注入体内，他的外貌也变得愈发丑陋骇人，把误入他办公室周围的“病人”吓得魂飞胆散。
25,艾克,时间刺客,祖安,刺客,人类,2015/5/28,艾克是一名来自祖安不良街区的奇才。他可以操纵时间，从而让任何处境都变得对自己有利。通过使用他自己的发明——Z型驱动——他可以探索其他平行现实的分支并创造最完美的条件。尽管他酷爱这种自由，但只要他的朋友们遇到了威胁，他就会不顾一切地去保护他们。在旁观者眼里，艾克总是能初次尝试就完成不可能之举，事事如此，概无例外。
26,伊莉丝,蜘蛛女皇,暗影岛,法师,人类,2012/10/26,伊莉丝是一名夺命的掠食者，栖息在诺克萨斯最古老城区深处的一座不见天日的破旧宫殿。她曾是一个显赫贵族的女族长，但后来邪恶卑鄙的蜘蛛之神咬伤了她，把她变为某种似人非人，却又美貌依旧的怪物——像蜘蛛一样，将粗心大意的猎物引入自己的天罗地网。如今的伊莉丝以单纯之人和背弃誓言者为食，几乎无人能抵抗她的诱惑。
27,伊芙琳,痛苦之拥,符文之地,刺客,恶魔,2009/5/1,在符文之地的黑暗裂缝中，恶魔伊芙琳一直在搜寻着下一个目标。她披着人类女性的撩人外表，勾引她的猎物。只要有人被她魅惑，伊芙琳就会显露出真正的形态。她会施加难以言喻的折磨，从而让自己在猎物的疼痛中获得满足。对于这个恶魔来说，这样的欢愉只是无心无邪的滥情。但是对于符文之地上的其他人，听到的则是血肉模糊的传说，提醒着人们肉欲的危险和纵欲的代价。
28,伊泽瑞尔,探险家,皮尔特沃夫,射手,人类,2010/3/16,"神采奕奕的冒险家伊泽瑞尔拥有自己不知道的魔法天赋，他搜刮失落已久的古墓，触碰古老的诅咒，还举重若轻地挑战常人不可能完成的极限。他的勇气和壮举无边无际，总是喜欢随机应变地解决任何情况，一定程度上依赖他的小聪明，但更主要是依赖他神秘的恕瑞玛护手，在他的操控下释放出破坏性的奥术爆弹。有一件事可以肯定——只要伊泽瑞尔出现，那么麻烦一定接踵而至。或是还没走远。范围大概是随时随地。
"
29,费德提克,远古恐惧,符文之地,法师,恶魔,2009/2/21,符文之地上有什么东西苏醒了。它古老悠久、恐怖骇人。这个被称为费德提克的远古恐惧无声无息地行走在凡人社会的边缘，被恐慌气氛所吸引，以猎物的惊骇为食。它化身成枯瘦简陋的实体，挥舞着破旧的镰刀，亲自收割恐惧。那些不幸从它手中活下来的人，心智会被彻底摧毁。务必小心乌鸦的声音，或者某个像是人类的身影发出的低语……费德提克回来了。
30,菲奥娜,无双剑姬,德玛西亚,战士,人类,2012/2/29,菲奥娜是全瓦洛兰最可怕的决斗家。她以雷厉风行、巧腕明政闻名于世，同样著名的还有她舞弄自己佩剑的极速。菲奥娜出生在德玛西亚的劳伦特家族，在一场险些令家族灭亡的丑闻风波过后，她从父亲的手中接管了家业。如今她致力于重振家族荣耀，让劳伦特这个名字重回德玛西亚名望贵族之列。
31,菲兹,潮汐海灵,符文之地,刺客,约德尔人,2011/11/15,菲兹是一名水陆两栖的约德尔人，生活在比尔吉沃特周围的群礁之间。他会经常把迷信的船长们抛进海中的什一税捡起来物归原主。不过即使是最粗鲁的水手也知道不要招惹他，因为这里流传着的各种教训，都是因为低估了这个小鬼。经常有人误会他的行为只是海洋精灵的任性举动，而事实上他可以号令来自深渊的巨型猛兽，而且不管是盟友还是敌人他都喜欢捉弄。
32,加里奥,正义巨像,德玛西亚,坦克,非人,2010/8/10,德玛西亚雄都之外，巨型石像加里奥始终如一地守望着。他被创造出来是为了抵挡来犯的法师，但却经常要一动不动地矗立数十年，只有当强大的魔法力量出现时，他才会被激活。而只要加里奥活动起来，他便会充分利用每一刻，品味荡气回肠的战斗和来之不易的守护人民的荣耀。可惜，他的胜利永远都喜忧参半，因为消灭魔法的同时，也消灭了他活跃力量的源泉。每一次胜利都会使他再次进入不知世事的休眠。
33,普朗克,海洋之灾,比尔吉沃特,战士,人类,2009/8/19,诡计多端、心狠手辣的普朗克是被废黜的强盗之王，他令人恐惧的名号广达远至。他一度是港口城市比尔吉沃特的统治者。虽然现在他的威权已经不再，但人们相信这只会让他变得更加可怖。普朗克若是知道有人要从他手中抢走比尔吉沃特，必然会大肆血洗这座城市。而如今有了火枪、弯刀，还有一桶桶的火药，他决心要夺回自己失去的东西。
34,盖伦,德玛西亚之力,德玛西亚,战士,人类,2010/4/27,身为一位自豪而且高贵的士兵，盖伦奋战在无畏先锋的最前沿。他深受战友们的爱戴，也受到敌人们的尊敬——同样重要地，他还是冕卫家族的名门之后，肩负着守卫德玛西亚及其理念的重任。他身披抵御魔法的重甲，手持阔剑，时刻准备着用正义的钢铁风暴在战场上正面迎战一切操纵魔法的狂人。
35,古拉加斯,酒桶,弗雷尔卓德,战士,人类,2010/2/2,豪爽而且威严的古拉加斯是一位身宽体胖、吵闹喧哗的酿酒大师，只为找到最完美的那一口麦酒。他从未知的地方前来，在弗雷尔卓德纯洁的荒原上寻找稀有的酿酒原料，尝试着各种不同的酿制配方。他总是酩酊大醉而且冲动鲁莽，他挑起的斗殴事件堪称传奇，经常造成一整夜的狂欢和殃及池鱼的破坏。只要古拉加斯在某地现身，接踵而至的往往是饮酒和闹事——就按这个顺序。
36,格雷福斯,法外狂徒,比尔吉沃特,射手,人类,2011/10/19,马尔科姆•格雷福斯是有名的佣兵、赌徒和窃贼，凡是他到过的城邦或帝国，都在通缉悬赏他的人头。虽然他脾气暴躁，但却讲究黑道的义气，他的双管霰弹枪“命运”就经常用来纠正背信弃义之事。几年前他和老搭档崔斯特•菲特冰释前嫌，如今二人一同在比尔吉沃特的地下黑道纷争中再次如鱼得水。
37,格温,灵罗娃娃,暗影岛,战士,非人,2021/3/30,格温是一个被魔法赋予了生命的玩偶，而她所挥使的正是当初创造了她自己的工具。格温无比珍惜这份机缘，踏出的每一步都承载着曾经主人的爱意。格温拥有控制“圣霭”的能力。这是一种来自远古的庇护性法术，她的剪刀、衣针和缝线都因圣霭而得到了庇佑。即便有这么多新奇的事物等待着格温，她既感到兴奋，但又带着强烈的使命感，决心拯救在这个破碎世界里艰难挣扎的人们。
38,赫卡里姆,战争之影,暗影岛,战士,非人,2012/4/18,赫卡里姆是人与野兽的融合体，诅咒让他永世狂奔。当福光岛堕入暗影，这位高傲的骑士在破败之咒的破坏性能量中瓦解，一起陪葬的还有他手下的骑兵与坐骑。如今，只要黑雾延伸到符文之地，他就将带领毁灭性的冲锋，在屠杀中狂喜，用铁蹄碾压一切敌人。
39,黑默丁格,大发明家,皮尔特沃夫,法师,约德尔人,2009/10/10,塞西尔·B·黑默丁格教授是一个才华横溢但古怪反常的约德尔科学家。他被称赞为皮尔特沃夫前所未见的最具革新意识和受人尊敬的发明家之一。他不间断地工作，孜孜不倦地尝试解答宇宙中最费解的难题，达到了神经痴迷的程度。尽管他的理论经常会看起来晦涩难懂，但他也曾制造出许多发明，堪称皮尔特沃夫最为惊奇，当然也同样危险的机械，他也在不断改进自己的发明，让它们更加高效。
40,俄洛伊,海兽祭司,比尔吉沃特,战士,人类,2015/11/24,俄洛伊的体格强横无比，却唯独会在她的坚定信仰面前屈身。作为大海兽的先知，她挥舞着一个巨大的金色神像，将敌人的灵魂抽离体外，完全击毁他们对现实的感知。所有对“娜伽卡波洛丝的真者”发起挑战的人，很快就会发现，俄洛伊从来不单打独斗——蟒行群岛的神明会与她并肩作战。
41,艾瑞莉娅,刀锋舞者,艾欧尼亚,战士,人类,2010/11/16,诺克萨斯对艾欧尼亚的占领催生了许多英雄，但没有谁像纳沃利的艾瑞莉娅一般令人意外。她将家乡的古老舞艺化为战技，以精心修习的优雅身姿操控着致命的刀丛。在她证明了自己的战斗实力后，被众人推举为反抗军的领袖和首脑，为了守卫家园而奋斗至今。
42,艾翁,翠神,艾欧尼亚,辅助,非人,2016/10/5,艾翁，许多认识他的人都称他为荆足或者老樵夫，他是一个半人半树的奇特生物，游荡在符文之地的荒野上，所经之处无不生机盎然。他知晓自然界的种种秘密，无论是飞禽走兽还是游鱼虫孑，都与他交谊深厚。艾翁会培植丰茂的森林，向路遇的凡人传授奇特的智慧，时不时地，他也会向口风不严的蝴蝶托付自己所知的秘密。
43,迦娜,风暴之怒,祖安,辅助,神,2009/9/2,作为悠久而神秘的风之精灵，如今的迦娜保护着祖安的穷苦百姓。虽然她最常现身的形式是柔和的轻风或猛烈的龙卷，但她也能化成仙女般的实体，安慰困境中的人们。万古以来，迦娜见证了文明的兴衰起落。自始至终，她都是一座屹立不倒的灯塔信标，让绝望之人看到希望。
44,嘉文四世,德玛西亚皇子,德玛西亚,坦克,人类,2011/3/1,作为国王的独生子，嘉文皇子是显而易见的德玛西亚王位继承人。他自小被寄予厚望，有朝一日能够成为德玛西亚的楷模，而如此沉重的负担令他想在战场上证明自己的心中充满了挣扎。作为一名独具杰出天赋的战士，他英勇无畏的气势和一往无前的决心鼓舞着全军上下，显现出身为人主的真实才干。
45,贾克斯,武器大师,符文之地,战士,人类,2009/2/21,贾克斯是符文之地最伟大的武器大师，也是考阿利的唯一幸存者——他们是一群誓死保卫艾卡西亚的守护者。但当虚空被释放出来对抗恕瑞玛帝国的飞升之团，艾卡西亚遭到了摧毁，让贾克斯失去了故乡和前进的目标。他回收了“艾卡西亚最后的光”，作为他有朝一日击败虚空的希望象征，如今他遍及全世界，寻找足够强大的战士，与他共同对抗即将到来的黑暗。
46,杰斯,未来守护者,皮尔特沃夫,战士,人类,2012/7/7,杰斯是一位天才发明家，他为了守护皮尔特沃夫和这座城市对于进步的追求贡献了毕生的心血。杰斯依靠手中的海克斯科技变形锤，还有自己的力量、勇气和出众的智慧守护着他的故乡。虽然整座城市都将他视为英雄，但他却并没有处理好这样的声名。即便如此，杰斯的心之所向依旧纯良，即使是那些嫉妒他天赋的人，也会真心实意地感谢他给进步之城带来的保护。
47,烬,戏命师,艾欧尼亚,射手,人类,2016/2/1,作为一名心思缜密的癫狂杀手，烬坚信谋杀是一门艺术。他曾在艾欧尼亚的监狱中服刑，但却因为执政议会里涌动着的暗流而得到释放，成为了权术斗争所利用的刺客。烬将手中的枪当成画笔，尽情地挥洒他所追求的残忍艺术，让受害者肝胆俱裂，令旁观者震悚难平。他在自己制作的阴森剧目里肆意取乐，让“恐怖”二字有了最合适不过的信使。
