148,约里克,牧魂人,暗影岛,战士,人类,2011/6/22,约里克所在的教团早已被世人忘却，而他也成为了最后的幸存者。说不上是诅咒抑或是祝福，他拥有操控死者的能力。与他一同被困在暗影岛上的，只有逐渐腐败的尸体，还有他引到自己身边终日尖啸的死灵。约里克怪异的举止下掩藏着的却是他决绝的憧憬：解放他的家园于破败之咒的阴影下。
149,悠米,魔法猫咪,班德尔城,辅助,人类,2019/4/25,作为一只来自班德尔城的魔法猫咪，悠米曾是一名约德尔魔女诺拉的宠物。而当主人神秘消失以后，悠米就成为了《门扉魔典》的守护者，这是诺拉留下的一本有灵性的书。悠米带着魔典一起穿越书页中的传送门，共同寻找诺拉。渴望被宠爱的悠米在她的旅途中寻找着友善的同伴，为同伴们提供闪光护盾和坚决的意志作为保护。虽然魔典竭尽全力让她把注意力留在最初的任务上，但悠米经常会被世俗的安逸所吸引，比如打盹和吃鱼。但安逸过后，她总是会回归自己的任务，找寻自己的朋友。
150,扎克,生化魔人,祖安,坦克,非人,2013/3/29,一滩泄漏的毒液，顺着炼金科技设施的裂缝流进了祖安的地沟区，在深处一个与世隔绝的坑洞里积成了一洼。出身虽然如此低微，但扎克却从一团蒙昧的黏液长成了一个有思想的实体，栖息在城里的管道中，偶尔露面，帮助那些无助的人，或是修缮祖安的各种公共设施。
151,劫,影流之主,艾欧尼亚,刺客,人类,2012/11/13,"彻底抛弃了仁慈与怜悯的劫，是影流教派的领袖。他创立影流的目标是将艾欧尼亚的魔法和传统武术用于实战，驱逐诺克萨斯侵略者。在战争中，绝望指引他开启了神秘的暗影形态。这是一种恶灵魔法，虽然强大，但同时非常危险且有腐化之力。劫已经完全掌握了这种禁忌之术，用它摧毁自己眼中的威胁，维护自己的国家，以及自己的教派。
"
152,吉格斯,爆破鬼才,祖安,法师,约德尔人,2012/2/1,炸弹越大越好，引线越短越好，带着这种喜好的约德尔人吉格斯就是天生的爆炸狂人。他曾是皮尔特沃夫一位发明家的助手，不过因为自己千篇一律的生活而感到无聊，后来和一个名为金克丝的蓝头发小疯子交上了朋友。疯狂的城中一夜过后，吉格斯接受了她的建议，搬到了祖安，在那里更加自由地探索自己着迷的东西。在他对于爆炸的无尽追寻过程中，恐吓一直伴随着炼金男爵和普通市民之流。
153,基兰,时光守护者,符文之地,辅助,人类,2009/4/18,作为艾卡西亚统辖议会的成员之一，基兰是一位天赋异禀的元素法师，追寻时间本质的奥秘。他曾发动力量挽救他的人民于虚空侵袭，如今的他在过去、现在、和未来之间漂泊，弯折、扭曲自己周围的时间。基兰曾踏遍时间长河，从符文之地的神秘诞生，一直到它看似不可避免的结局，寻找着任何丝缕的命运，让他有可能挽回家园的毁灭。
154,佐伊,暮光星灵,巨神峰,法师,星灵,2017/11/9,调皮捣蛋、异想天开而且变化莫测，佐伊就是这一切的现实化身。作为巨神族的宇宙信使，她的出现就是惊天巨变的先兆。她甚至无需任何行为，只是单纯地出现在某个地方，就足以扭曲周围的奥术数学法则，从而扰乱现实的物理定律。有的时候还会带来浩劫与灾难，虽然她本身并无半点恶意。或许这就是为什么她对待自己的职责总是那么的漫不经心，给了她充足的时间用来玩游戏、捉弄凡人，或者自娱自乐。与佐伊的邂逅可能会给人带来欢乐与激励，但她的现身往往没这么简单，甚至常常意味着极大的危险。
155,婕拉,荆棘之兴,以绪塔尔,法师,非人,2012/7/24,婕拉诞生于一次远古的巫术灾难，她是获得了实体形态的自然之怒，是拥有诱人外观的植物与人类的混合体。她的每一个脚步都在点燃新的生命。在她眼里，瓦洛兰的众多凡人都只不过是供她播种的猎物，用夺命的尖刺杀死他们也是一件不值一提的小事。虽然她的真正目的还是个谜，但婕拉一直在世界上流浪，肆意放纵自己占领土地的欲望，同时扼杀自己领地上的所有其他生命。
