48,金克丝,暴走萝莉,祖安,射手,人类,2013/10/10,神经狂躁、冲动任性、劣迹斑斑……金克丝出身自祖安，生来就爱不计后果地大搞破坏。她就是一座人形自走军火库，所经之处必定会留下夺目的火光和震耳的爆炸。金克丝最讨厌无聊，所以不管她去到哪里，混乱和骚动就会如期而至，这就是她留下的“到此一游”。
49,卡莎,虚空之女,虚空之地,射手,人类,2018/3/2,在孩童时期就被虚空夺走的卡莎，凭着纯粹的固执和意志力活了下来。她的历练让她成为了一位夺命的猎手，或者也有人会称她为黑暗未来的使者。她与一副有生命的虚空生物甲壳形成了一种不得安宁的共生状态，而很快她就将面临一个重大的抉择，究竟是原谅那些称她为怪物的凡人并协力抵御压境的黑暗……还是干脆忘记，放任虚空吞噬这个已将她抛弃的世界。
50,卡莉丝塔,复仇之矛,暗影岛,射手,暗影,2014/11/20,卡莉丝塔是充满复仇怨念的幽灵，是不灭的复仇之魂，是来自暗影岛的噩梦，专门猎杀背信弃义之人。背叛行为的受害者会以血泪盼望复仇，但卡莉丝塔只会回应那些愿意献出灵魂作为代价的人。只要被卡莉丝塔盯上就应该了却尘愿，因为这位死亡猎手终结誓约的方式只有一种，那就是她灵魂标枪上的冷酷灵火。
51,卡尔玛,天启者,艾欧尼亚,法师,神,2011/2/1,"要说哪位英雄能代表艾欧尼亚的精神传统，没有谁比卡尔玛更合适。她是一个古代灵魂在当代的化身，经历过无数次转世，每次获得新生都会继承以前的全部记忆，同时也被赐予常人无法理解的力量。她在最近一次遭遇危难之时倾尽全力引领他的人民，但她知道，要获得和平与和谐，就必须付出重大代价——既是对她自己，也是对她深爱的土地。
"
52,卡尔萨斯,死亡颂唱者,暗影岛,法师,暗影,2009/6/12,卡尔萨斯是湮灭的使者，是不死的亡灵。从来都是未见其恐怖身影，先闻其鬼魅挽歌。活着的人惧怕那些永世不得超生的亡灵，但卡尔萨斯却在亡灵的存在中只看到了美丽和纯洁，这是生与死的完美融合。当卡尔萨斯从暗影岛获得新生的时候，他决心要担任不死亡灵的使徒，把死亡的欣喜带给所有凡人。
53,卡萨丁,虚空行者,虚空之地,刺客,虚空生物,2009/8/7,在世界上最黑暗的地方，卡萨丁切出了一道燃烧的裂口，他知道自己已经时日无多。他曾是恕瑞玛地区的向导和冒险家，后来选择在恕瑞玛南方平静的部落中安家落户——直到那一天，他的村庄被虚空吞噬。卡萨丁发誓要报仇雪恨，于是整合了许多秘法器物和禁忌之术，以便应对前方的险阻。最后，卡萨丁动身前往艾卡西亚的废土，准备面对任何虚空的造物，寻找那位自封的先知，玛尔扎哈。
54,卡特琳娜,不祥之刃,诺克萨斯,刺客,人类,2009/9/19,果断坚决、心狠手辣，卡特琳娜是诺克萨斯的顶尖刺客。作为传奇将军杜·克卡奥的长女，她凭借出其不意的迅猛刺杀很快声名鹊起。强烈的野心曾经驱使她挑战重兵把守的暗杀目标，甚至不惜冒险让友军暴露在危险中。不过无论是怎样的任务，卡特琳娜都会毫不迟疑地在锯刃匕首的风暴中履行自己的使命。
55,凯隐,影流之镰,艾欧尼亚,刺客,暗裔,2017/7/10,"悉达·凯隐是暗影魔法的天纵之才，他战斗的意义，是为了实现自己真正的命运——为了有朝一日能够率领影流教派，开创艾欧尼亚霸业的新世代。凯隐挥舞着活体暗裔武器拉亚斯特，毫不在意它给自己身体和思想带来的腐化。这样后果只可能有两种：要么凯隐驯服这把武器屈从自己的意志；要么，这恶毒的刀刃将他彻底吞噬，为符文之地的毁灭铺平道路。
"
56,凯尔,正义天使,德玛西亚,战士,星灵,2009/2/21,在符文战争最激烈的时刻，一位巨神星灵诞下了凯尔，她传承了母亲的荣耀，高举圣火的飞翼，为了正义而战。她和孪生妹妹莫甘娜曾是德玛西亚的保护神——但凡人反反复复的失败最终让凯尔的幻想破灭，彻底抛弃了这个国度。但关于她用火焰长剑惩罚不义之徒的传说依然在流传，关于她终将回归的希望也依然在持续……
57,凯南,狂暴之心,艾欧尼亚,法师,约德尔人,2010/4/8,历史悠久的均衡教派中，有一位资历最老的成员——约德尔人凯南是第一任也是唯一一任狂暴之心。几百年里，他使用委婉的交涉和直接的武力，维持着他第二故乡——艾欧尼亚的神圣平衡。凯南拥有闪电的速度和岁月沉淀的智慧，他与暮光之眼——慎一起保护着初生之土的脆弱和谐，用霹雳千鸟和万雷天牢扫除一切障碍。
58,卡兹克,虚空掠夺者,虚空之地,刺客,虚空生物,2012/9/27,虚空在成长，虚空在不断适应。在众多虚空生物中，没有哪种比卡兹克更能体现这一特性。进化的动力让这种恐怖不断变异，本能地求生并弑杀强者。只要它遇到了障碍，就会进化出新的、更有效的方法反制并杀掉猎物。卡兹克最初只是个愚钝的野兽，然而它的智力和它的形态一样获得了发展。现在，这只生物会提前计划狩猎行动，甚至懂得在猎物心中制造最真实的恐惧。
59,千珏,永猎双子,符文之地,射手,神,2015/10/14,千珏，作为象征死亡的一对精魂，他们互相独立，却从未分离。对于坦然接受命运的人来说，羊灵的长弓可以痛快地送他们离开生者的乐园，而妄图逃脱宿命的人则由狼灵追捕，痛苦地倒在他有力的撕咬下。虽然在符文之地上到处是关于千珏的不同传言，但每个人在临终时都会看到死亡的真正面孔。至于是哪一面，完全出自个人的抉择。
60,克烈,暴怒骑士,诺克萨斯,战士,约德尔人,2016/8/10,无畏而且狂暴的约德尔人克烈是诺克萨斯意志的化身。很多军士都说，克烈参与了有史以来帝国战群发动的每一场征战，获得了军中的每一份头衔，而且从来没有却步于任何一次战斗。虽然传闻总是不可全信，但至少有一件事毋庸置疑：只要克烈骑着胆小的斯嘎尔冲进战场，他的战斗便是为了保住所拥有的一切……或是抢走他想要的一切。
61,克格莫,深渊巨口,虚空之地,射手,虚空生物,2010/6/24,从艾卡西亚废墟深处的腐败裂口中，克格莫喷着进食后的胀气走入了符文之地，它是一只好奇的生物，然而身上散发着腐烂的恶臭，血盆大口里淌着腐蚀性的粘液。这只特别的虚空生物需要用牙齿和口水去理解周围的事物。虽然克格莫并非本性邪恶，但它的天真无知同样很危险，因为它的无知往往预示着一场疯狂的暴食——并不是为了填饱肚子，而是为了满足它无尽的好奇。
62,乐芙兰,诡术妖姬,诺克萨斯,刺客,人类,2010/11/2,即使是在秘密团体黑色玫瑰的成员内部，乐芙兰也同样保持神秘，而乐芙兰这个名字也只是众多化名之一。这个皮肤惨白的女人自从诺克萨斯建国初期就开始操纵大小人物，推动事态发展。这位女法师能用魔法制造自己的镜像，她可以出现在任何地点、任何人面前、甚至同时现身于许多地方。乐芙兰永远都在暗处密谋策划，而她真正的动机和她变换不定的身份一样令人难以捉摸。
63,李青,盲僧,艾欧尼亚,战士,人类,2011/4/1,李青是艾欧尼亚古老武术的大师，讲原则、重信义的他能将神龙之灵的精粹运用自如，助他面对任何挑战。虽然他多年前便已双目失明，但这位武僧依然献出自己的全部力量，用生命捍卫家园，抵御任何胆敢打破这里神圣均衡的人。所有因他安静冥想的举动而掉以轻心的敌人都将品尝他燃烧的拳头和炽烈的回旋踢。
64,蕾欧娜,曙光女神,巨神峰,坦克,人类,2011/7/13,蕾欧娜是被灌注了烈阳之火的烈阳教派圣殿武士，用天顶之刃和破晓之盾守护着巨神峰。她的皮肤闪烁着星火，她体内天界星灵的力量透过她的双眼炯炯燃烧。蕾欧娜身披金色铠甲，背负着沉重的上古知识，为一些人带来启示，为另一些人带去死亡。
65,莉莉娅,含羞蓓蕾,艾欧尼亚,战士,非人,2020/7/7,羞怯难当的仙灵小鹿莉莉娅在艾欧尼亚的森林中蹦跳着游荡。她躲藏在凡人视线的边缘，因为凡人的神秘一直都让她着迷，同时也让她害怕。莉莉娅要查清楚为什么他们的梦境再也无法抵达幻梦树。如今她带着一根魔法树枝游历艾欧尼亚，寻找人们未实现的梦境。只有通过梦境，莉莉娅才能绽放，并帮助其他人解开恐惧的郁结，找寻内心的闪光。呦——！
66,丽桑卓,冰霜女巫,弗雷尔卓德,法师,寒冰血脉,2013/4/30,"大多数人都认为身为霜卫首领的丽桑卓是一个活着的圣人，为弗雷尔卓德的各族带来了智慧与治愈。但事实却非如此，她使用元素魔法将臻冰扭曲成黑暗的物质并用它来冰封或穿刺胆敢揭露她隐藏的秘密的人。她的过去可能是符文之地末日的起始。
"
67,卢锡安,圣枪游侠,符文之地,射手,人类,2013/8/22,"卢锡安，一名光明哨兵，一个狩猎不死亡灵的残酷猎手，使用一双圣物手枪进行无情的追踪与杀灭。当怨灵锤石夺走他妻子的生命后，卢锡安踏上了复仇之路。但即便她已重获新生，他的怒火也没有平息。无情而又固执的卢锡安将不惜一切代价，保护生者，对抗黑雾中那亡故已久的恐怖。
"
68,璐璐,仙灵女巫,班德尔城,辅助,约德尔人,2012/3/20,璐璐是一位约德尔女巫，最著名的能力是召来梦境般的幻觉和奇异的小动物，小仙灵皮克斯就是她云游符文之地的伙伴。璐璐可以突发奇想地重塑现实，改变世界的本质结构，改造这个平凡的物质领域中任何让她感觉是限制的东西。虽然其他人对她的魔法颇有微词，往好听了说是一种异象，往难听了说是一种危害。但是璐璐始终认为，一点魔力的启发对任何人都没有坏处。
69,拉克丝,光辉女郎,德玛西亚,法师,人类,2010/10/19,拉克珊娜·冕卫出身自德玛西亚，一个将魔法视为禁忌的封闭国度。只要一提起魔法，人们总是带着恐惧和怀疑。所以拥有折光之力的她，在童年的成长过程中始终担心被人发现进而遭到放逐，一直强迫自己隐瞒力量，以此保住家族的贵族地位。虽然如此，拉克丝的乐观和顽强让她学会拥抱自己独特的天赋，如今她的目标是为故土带来更多的宽容和理解。
70,墨菲特,熔岩巨兽,以绪塔尔,坦克,非人,2009/9/2,墨菲特是一个庞大的岩石生物，诞生于以绪塔尔的巨大建筑——“独石”的中心。他花费数百年之久研究符文之地的元素平衡，用万钧之力维护这个纷乱世界的秩序，碾碎地底之下爬行的黑暗生物。如今，他从沉睡中激醒的次数越来越频繁。墨菲特不得不忍受凡人们反复无常的性情，同时作为自己族类的最后一员，追寻着唯一值得为之奋战的大业。
71,玛尔扎哈,虚空先知,虚空之地,法师,虚空生物,2010/6/1,玛尔扎哈是一名狂热的先知，将自己的全部奉献给一切生命的大一统。他坚信，近来新出现的虚空就是符文之地的救赎。在恕瑞玛的沙漠荒原上，他曾一度追随着脑海中的窃窃私语，一路来到古艾卡西亚。在这片废墟中，他窥见了虚空深处的黑暗核心，被赋予了新的力量和目标。玛尔扎哈现在视自己为迷途羔羊的牧人，将其他人带进畜栏，或是放出藏身地下的虚灵生物。
72,茂凯,扭曲树精,暗影岛,坦克,非人,2011/2/16,茂凯是一只内心暴怒外形魁梧的树精，不知疲倦地对抗暗影岛的骇人异象。一场魔法灾变摧毁了他的家园，同时也将他变成一股复仇的力量，使他免遭不死诅咒的，全靠他芯中灌注融合的生命之水。曾经的茂凯是一只平和的自然之灵，而现在的他则一直在暴怒地战斗，只为了将不死的灾祸逐出暗影岛，让他的家园重归往日的秀美。
73,易,无极剑圣,艾欧尼亚,刺客,人类,2009/2/21,"易大师锤炼身体、磨砺心智，直至身心合一。尽管他将暴力作为不得已的选择，但他优雅迅猛的剑法总是让这一手段显得尤为快捷。作为无极之道最后的门徒，易大师致力于这个门派的传承，用七度洞悉目镜搜寻着最有资格的人，寻找潜在的新弟子。
"
74,厄运小姐,赏金猎人,比尔吉沃特,射手,人类,2010/9/8,以美貌闻名，但却以无情立命的莎拉是一位比尔吉沃特的船长，她在这座港镇的强硬犯罪集团中塑造了不容轻视的形象。在她还是个孩子的时候，亲眼目睹了海盗之王普朗克谋杀了自己的家人。多年以后她残忍地报仇雪恨，把他和他的旗舰连人带船一同炸飞。所有低估她的人都会发现，自己面对的是一个极具欺骗性的狡黠对手，还有可能要处理肚子里的一两颗子弹。
75,孙悟空,齐天大圣,艾欧尼亚,战士,瓦斯塔亚,2011/7/26,悟空是一个瓦斯塔亚族的机灵鬼，用自己的力量、灵敏和机智迷惑对手并抢得先机。机缘巧合让他结识了一位剑客并与之成为一生的挚友，这位剑客被人称作易大师。后来，悟空就成为了古老武术门派“无极”的最后一位弟子。如今，附魔长棍傍身的悟空，目标是让艾欧尼亚免遭崩溃的命运。
76,莫德凯撒,铁铠冥魂,诺克萨斯,战士,非人,2010/2/24,两度被杀，三度重生。莫德凯撒是一位来自远古纪元的残酷军阀，他使用死灵巫术将无数灵魂禁锢在永恒的奴役中。现在几乎无人记得他早期的那些征服战争，也无人知道他有多强大的力量，但也有一些古老的灵魂认得他，而他们一直都在担心有一天他会回来，同时统治生者和死者。
77,莫甘娜,堕落天使,德玛西亚,法师,星灵,2009/2/21,在天界与凡间双重本性的夹缝中左右为难的莫甘娜，束缚了自己的双翼并拥抱了人性，还将自己的痛苦和怨恨施加给那些失信和堕落之人。她与一切自己眼中不公正的法律和传统对抗，并从德玛西亚的阴暗中投出保护的盾牌和暗焰的锁链，与试图镇压真理的人战斗。最重要的是，莫甘娜坚信，即使是被放逐、被遗弃的人，也可能有朝一日重获新生。
78,娜美,唤潮鲛姬,符文之地,辅助,瓦斯塔亚,2012/12/7,娜美是一名强大年轻的瓦斯塔亚海族。当鲛人族与巨神族之间自古订立的契约被打破，她是第一个离开海洋、踏上陆地的人。她别无选择，只能挺身而出担此重任，完成神圣的仪式从而确保族人的安全。在这崭新时代的混乱浪潮中，娜美用无比的决心和无畏的斗志面对未知的明天，用手中的唤潮者之杖召唤来自海洋的力量。
79,内瑟斯,沙漠死神,恕瑞玛,战士,飞升者,2009/10/1,内瑟斯是一位庄严威武的犬首人身飞升者——他们是一群受到恕瑞玛的子民敬仰的比肩天神的人物。他的睿智中透着凶狠，作为知识的守护者和无双的战术家，用智慧引导帝国延续了数百年的繁荣伟大。阿兹尔飞升失败后，内瑟斯开始了自我放逐，成为了人们口中缥缈的传说。现在，太阳圆盘已经再一次崛起，他也随之回归，并决心绝不让它再度陨落。
80,诺提勒斯,深海泰坦,比尔吉沃特,坦克,非人,2012/2/14,早在比尔吉沃特立起第一座码头的时候，就有一个孤独的传说。身着铁甲的巨人诺提勒斯在蓝焰岛附近的黑暗水域中徘徊。他心里记恨着一桩不可原谅的背叛，毫无预警地出手。他甩动巨大的船锚，拯救落难的可怜虫，或是将贪婪的人拖进末日。据说，没有缴“比尔吉沃特什一税”的人就是他的目标。他会带着他们和自己一起沉入波涛——相当于一个铁板钉钉的提醒，没人能逃脱深海的制裁。
81,妮蔻,万花通灵,以绪塔尔,法师,瓦斯塔亚,2018/11/19,妮蔻来自一个早已迷失的瓦斯塔亚部落。她可以借用别人的外表来伪装自己，融入人群，甚至通过影响别人的情绪状态，一瞬间就能化敌为友。没人知道妮蔻到底在哪儿——或者到底是<i>谁</i>，但是想要为难她的人会立刻见识到她的本色，感受原始的精神魔法倾泻在自己身上的痛苦。
82,奈德丽,狂野女猎手,以绪塔尔,刺客,瓦斯塔亚,2009/12/17,在密林深处长大的奈德丽是一位追猎大师，她可以变换形态，成为一只凶猛的美洲狮。她既不是真正的人类，也不是真正的野兽，但她会用精心布置的陷阱和灵活自如的标枪，凶狠地捍卫自己的领地不被任何人侵犯。她会先打击猎物的行动能力，然后再以大猫的形态上前扑杀。只有很少数人曾侥幸逃脱并活下来讲述一个狂野女猎手的故事，讲述她锐利的猎手本能，以及更加锐利的爪子。
83,魔腾,永恒梦魇,符文之地,刺客,恶魔,2011/3/15,"将一切有知觉的脑海中萦绕的噩梦提取出来，进而融合成一个恶魔般的实体，这就是被人称为魔腾的存在，它已成为一种纯粹邪恶的原始力量。它的外形捉摸不定，一团无面的黑影中睁着一双冰冷的眼睛，身体两侧是一对形状恐怖的刀刃。魔腾摆脱了精神领域的束缚，一次又一次地进入梦醒后的凡尘世界，寻觅那些在真正的黑暗中疯长的恐惧，作为自己的食粮。
"
84,努努和威朗普,雪原双子,弗雷尔卓德,坦克,人类,2009/2/21,很久以前，曾有个小男孩，他要证明自己是个英雄，于是决定去杀掉一头凶猛的怪兽——但他却发现这个怪兽其实是个孤独的魔法雪人，而且他需要的只是一个朋友。雪人和男孩被古老的力量所连结，也因对雪球的共同爱好而玩到一起。努努和威朗普如今在弗雷尔卓德的土地上肆意撒欢打滚，为想象中的冒险注入鲜活的生命力。他们希望能够在前面的某个地方找到努努的母亲。如果他们能拯救她，或许他们就真的是英雄了……
85,奥拉夫,狂战士,弗雷尔卓德,战士,人类,2010/6/9,奥拉夫是一股无坚不摧的毁灭之力，战斧在手的他别无所求，只想光荣地死在战斗中。奥拉夫来自弗雷尔卓德的海岸半岛洛克法，他曾在一次占卜预言中听闻自己将安详地死去——这是懦夫的命运，也是对他们族人的莫大侮辱。于是，为了追寻另外一种结局，他在狂怒的驱动下在这片土地上暴跳横行，屠杀了数十名伟大的战士和传说中的野兽，希望能够找到能够阻止自己的对手。如今他是凛冬之爪部族残酷的执法者，希望在即将到来的大战中找到自己的终结。
86,奥莉安娜,发条魔灵,皮尔特沃夫,法师,非人,2011/6/1,奥莉安娜浑身上下全部由发条和齿轮构成，是一个科技的奇观，但她并非生来如此——她也曾是一个拥有血肉之躯的好奇女孩。由于祖安下层街区的一次事故，让奥莉安娜患上不治之症，她日渐衰竭的身体必须被一点点替换成精密的人造器官。如今的奥莉安娜带着一个非凡的黄铜球体，里面安放着她的海克斯心脏，她终于获得了自由，可以尽情探索皮尔特沃夫，以及更远处的奇景。
87,奥恩,山隐之焰,弗雷尔卓德,坦克,神,2017/8/22,奥恩是弗雷尔卓德的一位半神，主掌着锻造和工艺。他在名为炉乡的火山下的溶洞中凿出了一座雄伟的工坊，独自一人在里头干活。他摆弄着熔岩沸腾的坩埚，提炼矿石，打造出无与伦比的精良物件。当其他神灵——尤其是沃利贝尔，在大地上行走并且介入了凡间的事务时，奥恩就会出面，将这些鲁莽的家伙劝回各自的位置上。要么是用手里可靠的锤子，要么就是群山的烈火。
88,潘森,不屈之枪,巨神峰,战士,星灵,2010/2/2,曾经被战争星灵附体的阿特瑞斯，在他体内那股天界力量被弑杀的时候，以凡人的身份活了下来，即便是那裂空摘星的一击，也无法让他屈服。不久以后，他学会了拥抱自己凡性的力量，以及凡性之中顽强的韧劲。如今的阿特瑞斯作为重生的潘森，反抗神性。他坚不可摧的意志在战场上化为火焰，注入那些曾经属于星灵的武具中。
89,波比,圣锤之毅,德玛西亚,坦克,约德尔人,2010/1/13,符文之地从来都不缺勇敢的英雄，但很少有谁能像波比一样坚毅。她一直带着奥伦的传奇圣锤，哪怕锤柄立起来有两个她那么高。这位意志坚决的约德尔人在无数个岁月中一直都在秘密地寻找“德玛西亚的英雄”，也就是传说中这把战锤的最合适的主人。在找到他之前，波比肩负起战斗的使命，用旋风般的攻击打退王国的敌人。
90,派克,血港鬼影,比尔吉沃特,辅助,非人,2018/5/31,在比尔吉沃特的屠宰码头，颇有名气的鱼叉手派克葬身在一条巨大的琢珥鱼腹内……然而，他却回来了。他在家乡的阴街陋巷中徘徊着，用超自然的手段干脆残忍地解决那些鱼肉他人的恶棍——一座因捕猎怪物而自豪的城市如今发觉自己却成了狩猎的目标。
91,奇亚娜,元素女皇,以绪塔尔,刺客,人类,2019/6/7,在丛林都市以绪奥肯中，奇亚娜谋划着自己荣登育恩塔尔塔座的无情之路。作为父母的末位继承人，她以前无古人的元素魔法技艺，傲视所有挡在面前的人。这片大地服从着奇亚娜的每一道指令，她认为自己是以绪奥肯历史上最伟大的元素使——就凭这点，她理应执掌的不仅是一座城邦，而是一个帝国。
92,奎因,德玛西亚之翼,德玛西亚,射手,人类,2013/3/1,由布维尔家族资助的奎因，是德玛西亚的游骑兵，经常深入敌国腹地执行危险的任务，她与同伴——传奇巨鹰华洛之间存在着一种牢不可破的纽带，绝无仅有，致命非凡。很多时候，他们的对手死到临头也没意识到，自己面对着的这位德玛西亚英雄，并不是在孤军奋战。灵活矫健的奎因用十字弩瞄准射击，而华洛则在上空揪出隐藏的目标，他们之间的默契配合让战场上的敌人无处遁逃。
93,洛,幻翎,艾欧尼亚,辅助,瓦斯塔亚,2017/4/11,风流潇洒，魅力无穷，同时也令人难以捉摸的洛，是一位臭名远扬的瓦斯塔亚捣蛋鬼，也是洛特兰部落有史以来最为出色的战舞舞者。在艾欧尼亚高地居民的眼中，“洛”这个名字等同于热闹非凡的节日庆典、热火朝天的狂欢聚会和即兴乱奏的音乐。不过这个精力充沛的江湖艺人早已放弃了旧日的生活，全心全意投入爱人的事业——逆羽，霞的大义。他们一起，为艾欧尼亚的野生魔法谋求自由，让瓦斯塔亚重获与生俱来的权利。
94,拉莫斯,披甲龙龟,恕瑞玛,坦克,非人,2009/7/10,许多人对其崇拜敬仰，少数人对其嗤之以鼻，但所有人都对其一无所知。奇怪而有趣的生物拉莫斯就是一个谜团。他全身覆盖尖刺硬壳，人们对他的出身来历的猜测层出不穷——有人说他是半神，有人说他是神谕者，有人说他只是普通的野兽，遭遇了魔法的影响而发生彻底变异。无论真相如何，拉莫斯始终都默不作声，而且不会为任何人停留，永远都在恕瑞玛的沙漠中奔走游荡。
95,雷克塞,虚空遁地兽,虚空之地,战士,虚空生物,2014/12/11,作为食物链顶端的掠食者，残忍无情的虚空生物，雷克赛能够在地下挖掘隧道，偷袭并吞食毫无防备的猎物。她那永不满足的饥渴让曾经鼎盛一时的恕瑞玛帝国所在的地区满目疮痍。商人、贸易者和武装商队都会绕行百里，来躲开这些广袤的地区。一旦有人在遥远的地平线看到雷克赛，就等于看到自己葬身沙砾之下的命运。
96,芮尔,镕铁少女,诺克萨斯,辅助,人类,2020/11/23,芮尔是黑色玫瑰用凶残的试验一手制造出来的产物，她是狂妄的活体武器，决心要颠覆诺克萨斯。她的童年悲惨且惊悚，那些不可言说的处理过程将她的魔法塑造成完美的武器，让她可以任意控制金属。直到最后她展开了一场暴力的逃离，从数量众多的看管者中杀出一条血路。如今，被认定为逃犯的芮尔对诺克萨斯士兵进行无差别攻击，同时寻找着曾经“学院”里的幸存者，保护柔弱者，对曾经的那些教员送去无情的死亡。
97,雷克顿,荒漠屠夫,恕瑞玛,战士,飞升者,2011/1/18,雷克顿是一位来自恕瑞玛炙热沙漠中的面目可怖、野蛮狂怒的飞升者。他曾经是帝国最受尊敬的英雄，带领军队取得过无数次胜利。然而，在太阳圆盘陨落以后，雷克顿被困在了沙漠之下，慢慢地，在世界变迁的同时，雷克顿丧失了理智。现在他重获自由，但却被一个执念吞噬：找到并杀死他的哥哥内瑟斯，因为他坚信是内瑟斯害他经受了数百年黑暗束缚。
